type,name,description,description 2,powerLevel,clusterSize,theme,guaranteedPerLevel,damage,damagePerLevel,attackSpeed,apDamage,apDamagePerLevel,armor,armorPerLevel,antiMagic,antiMagicPerLevel,moveSpeed,tilesAffected,tilesAffectedPerLevel,lightRadius,throwEffect,tameOnThrow,useBehavior,useVerb,foodValue,appliesBuff,abilityPower,wandEffect,summonsWhenUsed,chargeGain,knockbackSquares,throwResult,glows,spriteCol,spriteRow
SWORD,sword,"A plain iron blade, friend of many an adventurer.","As well as decent damage, it's heavy enough to knock smaller enemies back a bit.",0.2_0.6,,,,2_5,1,1,,,,,,,,,,,DAMAGE,,NONE,,,,,,,,1,,,0,7
RAPIER,rapier,"A well-made blade, expertly balanced.",Rapiers do moderate damage but you can attack more often with them.,0.4_0.8,,,,3_7,2,0.6,,,,,,,,,,,DAMAGE,,NONE,,,,,,,,,,,2,7
KATANA,katana,"A deadly, razor sharp sword.",,0.6_1.0,,,,5_10,3,1,,,,,,,,,,,DAMAGE,,NONE,,,,,,,,,,,3,7
SHIELD,round shield,A round wooden shield.,Protects a bit against physical damage.,0.1_0.5,,,,,,,,,1_2,1_1,,,,,,,,,NONE,,,,,,,,,,,0,5
KITE_SHIELD,kite shield,A sturdy kite shield offering good protection.,,0.3_1.0,,,,,,,,,3_4,1_2,,,,,,,,,NONE,,,,,,,,,,,1,5
TORCH,torch,A blazing torch that casts bright light all around.,"Lights up the area, potentially changing how creatures and plants behave.  Also helps you go a bit faster.",0.2_0.6,,,,,,,,,,,,,0.9,,1,5,FIRE,,NONE,,,,,,,,,,,0,5
CHAIN_MAIL,chain mail,Mail made of rings.,It protects you somewhat against physical attacks.,0_0.4,,,,,,,,,2_3,1_1,,,,,,,,,NONE,,,,,,,,,,,0,4
SCALE_MAIL,scale mail,Overlapping iron scales on a leather backing.,It protects you fairly well against physical attacks.,0.3_0.7,,,,,,,,,4_5,1_2,,,,,,,,,NONE,,,,,,,,,,,0,4
HEAVY_MAIL,heavy plate mail,Thick plates of steel encase your body.,"Lots of protection against physical attack, at the cost of speed.",0.6_1.0,,,,,,1.1,,,6_8,2_4,,,1.1,,,,,,NONE,,,,,,,,,,,0,4
DAGGER,dagger,"A short bladed dagger, a classic weapon.",Not especially deadly but strikes rapidly.,0_0.3,,,,1_3,1,0.8,,,,,,,,,,,DAMAGE,,NONE,,,,,,,,,,,1,7
THROWING_KNIFE,throwing knife,This well balanced knife can be thrown from some way off.,Minor magic helps it return to its thrower -- a bit.,0_0.3,3,,,2_3,1,1,,,,,,,,,,,DAMAGE,,NONE,,,,,,,,,RETURN,,1,7
PUNCH_DAGGER,punch dagger,A fine dagger capable of slicing a foe to ribbons.,Often manages to get right past a foe's armor plates.,0.4_1.0,,,,1_3,2,1,2,,,,,,,,,,DAMAGE,,NONE,,,,,,,,,,,1,7
AMULET_OF_NIMBLENESS,amulet of nimbleness,A complex magical token that helps you move faster.,,0.3_0.7,,,,,,,,,,,,,0.8,,,,,,NONE,,,,,,,,,,,0,6
AMULET_OF_FINESSE,amulet of finesse,"An intricate sign traced in silver, it seems to aid your precision in combat.",,0.1_0.4,,,,,,0.8,,,,,,,,,,,,,NONE,,,,,,,,,,,1,6
AMULET_OF_DEFENCE,amulet of defence,"A blue, shield shaped gem in a gold setting.",Protects from physical blows.,0.2_0.8,,,,,,,,,1_2,1_3,,,,,,,,,NONE,,,,,,,,,,,2,6
AMULET_OF_WARDING,amulet of warding,"A grey, unremarkable amulet to look at.",Protects from magical and energy attacks.,0.3_1.0,,,,,,,,,,,2_4,1_3,,,,,,,NONE,,,,,,,,,,,3,6
AMULET_OF_LIGHT,amulet of light,"A pale gem set in silver, it shines brightly.",Light can change how creatures and plants act.,0.3_0.7,,,,,,,,,,,,,,,,10,,,NONE,,,,,,,,,,,4,6
FIRE_BOMB,fire bomb,A flask of unstable alchemy.," On impact, deals damage and ignites tiles around the target.",0.3_0.7,3,,,3,2,,,,,,,,,2,1,,FIRE,,NONE,,,,,,,,,CONSUME,,0,3
BLAST_BOMB,blast bomb,A heavy iron sphere full of magical powder.,Damages and pushes away everything around the point of impact.,0.4_0.8,3,,,6,4,,,,,,,,,2,1,,BLAST,,NONE,,,,,,,,1,CONSUME,,2,3
FREEZE_BOMB,freeze bomb,A frosted vial that shatters into a freezing burst.,"Chills enemies, extinguishes flames.",0.5_0.9,3,,,3,2,,,,,,,,,2,1,,FREEZE,,NONE,,,,,,,,,CONSUME,,3,3
OIL_BOMB,oil bomb,A glass sphere of dark oil. Shatters and slicks the floor on impact.,Oil is highly flammable.,0.1_0.5,3,,,3,2,,,,,,,,,2,1,,OIL,,NONE,,,,,,,,,CONSUME,,1,3
VOID_BOMB,void bomb,"A powerful bomb that draws in matter, creating a void.",Destroys floors and pulls creatures toward it.,0.2_1.0,3,,,6,6,,,,,,,,,2,1,,VOID,,NONE,,,,,,,,,CONSUME,,4,3
HEALING_POTION,healing potion,A vial of healing elixir.,"It doesn't work instantly, it helps you regenerate over time.",0_1.0,,,,,,,,,,,,,,,,,APPLYBUFFS,,DRINK,drink,,REGENERATION,4,,,,,CONSUME,,2,2
POWER_ORB,power orb,A sphere of power that makes you stronger.,Absorbed by touching.,0_1.0,,,1,,,,,,,,,,,,,,,,POWERUP,absorb,,,,LEVEL_UP,,,,,TRUE,0,8
WAND_WATER,wand of water,A pale blue wand that drips with water.,Creates a pool of water at the target location.,0.1_1.0,,,,,,,,,,,,,,5,4,,,,WAND,zap,,,,WATER,,1,,,,4,0
WAND_OIL,wand of oil,A dark wand slick to the touch. ,Creates a layer of oil at the target location.,0.2_1.0,,,,,,,,,,,,,,5,4,,,,WAND,zap,,,,OIL,,1,,,,1,0
WAND_GRASS,wand of vegetation,A green wand bound with vine.,Engenders vegetation at the target point.,0.2_1.0,,,,,,,,,,,,,,5,4,,,,WAND,zap,,,,GRASS,,1,,,,5,0
WAND_FUNGUS,wand of fungus,A spongy red-brown wand.,Causes mushrooms to grow at the target area.,0.4_1.0,,,,,,,,,,,,,,5,4,,,,WAND,zap,,,,FUNGUS,,1,,,,6,0
WAND_FIRE,wand of fire,A blackened wand crackling with embers. Ignites the target.,Spreads fire around the target point,0.4_1.0,,,,,,,,,,,,,,5,4,,,,WAND,zap,,,,FIRE,,0.5,,,,2,0
WAND_DOG,wand of dog,A wand decorated with a small animal head.,Summons a loyal dog to protect you.,0.1_0.4,,,,,,,,,,,,,,,,,,,WAND,summon,,,,,DOG,0.25,,,,3,0
WAND_DETONATION,wand of detonation,A blackened iron wand inlaid with red runes. Detonates the target tile in a ball of fire.,Blows the target location to smithereens.,0.5_1.0,,,,,,,,,,,,,,5,4,,,,WAND,zap,,,,DETONATION,,0.5,1,,,2,0
WAND_MAGIC_MISSILE,wand of magic missile,A short wand topped with a pale chip of crystal.,Sends out a magical bolt that does moderate damage.,0_1.0,,,,3_6,1_2,,,,,,,,,,,,,,WAND,zap,,,,MISSILE,,2,,,,0,0
WAND_BANISHMENT,wand of banishment,A wand bound in tarnished silver and tipped with flickering crystals.,This specialized wand can instantly banish creatures that are not really real.,0.6_1.0,,,,,,,,,,,,,,,,,,,WAND,zap,,,,BANISHMENT,,0.5,,,,7,0
WAND_LIGHTNING,wand of lightning,A wand that crackles with energy. ,Effect jumps from target to target and is stronger in water -- beware.,0.2_1.0,,,,4_10,1_2,,,,,,,,,,,,BLAST,,WAND,zap,,,,LIGHTNING,,0.5,,,,8,0
WAND_POLYMORPH,wand of polymorph,A wand that constantly shifts and changes.,Can turn a creature into something else.,0.5_1.0,,,,,,,,,,,,,,,,,,,WAND,zap,,,,POLYMORPH,,0.25,,,,9,0
PEAR,pear,A ripe green pear.,A surprisingly common and nutritious food.,0_1.0,,,1,,,,,,,,,,,,,,,,EAT,eat,10000,,,,,,,,,0,1
FISH,delicious fish,A small fresh fish. ,So tasty that a stray cat or dog you throw it to will follow you for the rest of its life.,0_1.0,,,,,,,,,,,,,,,,,,CAT|DOG,EAT,eat,30000,,,,,,,,,1,1
PEAR_SCRUMPTIOUS,scrumptious pear,"A specially ripe pear, dripping with juice. Five times more filling than the ordinary kind.",,0.2_1.0,,,,,,,,,,,,,,,,,,,EAT,eat,50000,,,,,,,,,2,1
PEAR_SILVERY,silvery pear,A pear with skin that shimmers like polished silver. Mysterious.,,0.4_1.0,,,,,,,,,,,,,,,,,,,EAT,eat,10000,HOPE,2,,,,,,,3,1
PEAR_CONFERENCE,conference pear,"A long elegant pear, reportedly the kind eaten at high meetings.",,0.3_1.0,,,,,,,,,,,,,,,,,,,EAT,eat,10000,ESP,2,,,,,,,4,1
POTION_SORCERY,potion of sorcery,A glittering brew that infuses the drinker with magical energy.,Increases the power of wands while its effects are active.,0_1.0,,,,,,,,,,,,,,,,,APPLYBUFFS,,DRINK,drink,,SORCERY,2,,,,,CONSUME,,0,2
POTION_GHOSTLINESS,potion of ghostliness,A swirling pearl-grey liquid.,The drinker becomes briefly ethereal and can pass through walls.,0.3_1.0,,,,,,,,,,,,,,,,,APPLYBUFFS,,DRINK,drink,,GHOSTLY,2,,,,,CONSUME,,1,2
POTION_INVISIBILITY,potion of invisibility,A clear potion that hides the imbiber from sight for a short while.,Invisibility ends if you attack.,0_1.0,,,,,,,,,,,,,,,,,APPLYBUFFS,,DRINK,drink,,INVISIBLE,5,,,,,CONSUME,,3,2
POTION_POISON,potion of poison,"A sickly green elixir. Vile to drink, devastating to throw.","If thrown, creates a puff of poison vapor.",0_1.0,,,,4_8,1_2,,,,,,,,,,,,POISONCLOUD,,DRINK,drink,,POISONED,3,,,,,CONSUME,,4,2
POTION_INSIGHT,potion of insight,A clear potion that crackles faintly., Reveals the layout of the entire level on a draught.,0_1.0,,,,,,,,,,,,,,,,,APPLYBUFFS,,DRINK,drink,,INSIGHT,1,,,,,CONSUME,,5,2
POTION_ESP,potion of levitation,A fizzy potion that seems to weigh nothing.,Confers levitation on the drinker.,0_1.0,,,,,,,,,,,,,,,,,APPLYBUFFS,,DRINK,drink,,ESP,10,,,,,CONSUME,,7,2
POTION_LEV,potion of perception,A glutinous potion that seems made of eyeballs.,Allows the drinker to perciev distant creatures.,0_1.0,,,,,,,,,,,,,,,,,APPLYBUFFS,,DRINK,drink,,LEVITATING,10,,,,,CONSUME,,6,2
FOUL_MEAT,foul meat,"A rotting, disgusting gob of mystery meat.",There are probably particularly vile creatures that would be glad to be given this.,0.3_0.7,,,,,,,,,,,,,,,,,,BLOB,EAT,eat,5000,,1,,,,,,,5,1
ANT_JELLY,ant jelly,"Ants make this ultra nourishing jelly, as healthy as it is revolting.",Regenerates health.,0.5_1.0,,,,,,,,,,,,,,,,,,RED_ANT|BLACK_ANT,EAT,eat,40000,REGENERATION,10,,,,,,,6,1
TASTY_MEAT,tasty meat,A plump pink chunk of tasty meat.,,0.4_0.8,,,,,,,,,,,,,,,,,,,EAT,eat,30000,,1,,,,,,,7,1
IPWERGIS,ipwergis-pudding,Ipwergis-pudding is a magically delectable food with many powers.,Grants insights if eaten; magical creatures might be very pleased to be given it.,0.7_1.0,,,,,,,,,,,,,,,,,,MASK_IMP|LARGE_MASK_IMP|DEVELOPED_MASK_IMP|HORRIBLE_MASK_IMP,EAT,eat,100000,ESP|INSIGHT,1,,,,,,TRUE,8,1
GRAPPLING_HOOK,grappling hook,A hook on a strong rope.,"Can pull enemies -- smaller ones, at least -- toward you.",0_0.5,,,,,,,,,,,,,,,,,,,GRAPPLE,grapple,,,3,,,,,,,5,8
VINE_HOOK,grapplevine,"This powerful magical vine wraps itself around a foe, allowing you to haul them nearer.",Can pull enemies -- even quite large ones -- toward you.,0_0.5,,,,,,,,,,,,,,,,,,,GRAPPLE,grapple,,,6,,,,,,,6,8
FROG,frog of jumping,A very lifelike small enamel frog -- or is it a real frog staying very still?,Use it from a quickslot to jump rapidly away from or toward your foes.,0.6_1.0,,,,,,,,,,,,,,,,,,,JUMP,jump,,,2,,,,,,,7,8
FROG2,frog of somersaulting,A multicolored enamel frog -- or is it a real frog staying very still?,Use it from a quickslot to jump rapidly away from or toward your foes.,0.8_1.0,,,,,,,,,,,,,,,,,,,JUMP,jump,,,4,,,,,,,8,8
BLINKSTONE,blinkstone,A very lifelike small enamel frog -- or is it a real frog staying very still?,Use it from a quickslot to jump rapidly away from or toward your foes.,0_1.0,,,,,,,,,,,,,,,,,,,WAND,blink,,TELEPORT,6,,,0.5,,,,9,8
HEALTHPILL,healthpill,A valuable scrap of health.,Absorbed instantly on touching.,0_1.0,,,10,,,,,,,,,,,,,,,,POWERUP,absorb,,,0.1,HP_UP,,,,,TRUE,1,8
CHARGEPILL,chargepill,A scrap of magical energy for your items.,Absorbed instantly on touching.,0_1.0,,,10,,,,,,,,,,,,,,,,POWERUP,absorb,,,1,MANA_UP,,,,,TRUE,2,8
