type,name,description,slot,material,damageMin,damageMax,armorMin,armorMax,lightRadius,foodValue,healAmount,thrownBehavior,useBehavior,useVerb,wandElement,summonsWhenUsed,tameOnThrow,appliesBuff,buffDuration,selfDamageBase,spriteCol,spriteRow,glows,silhouetteForSlot
SWORD,sword,A plain iron blade. Heavy enough to bludgeon a goblin with if thrown.,WEAPON,METAL,2,5,0,0,0,0,0,DAMAGE,NONE,,,,,,0,0,0,7,false,WEAPON
SHIELD,shield,"A round wooden shield. Blocks blows, but too light to bruise anyone.",OFFHAND,WOOD,0,0,1,2,0,0,0,NOTHING,NONE,,,,,,0,0,0,5,false,OFFHAND
SCALE_MAIL,scale mail,Overlapping iron scales on a leather backing. Painful to be hit by.,ARMOR,METAL,0,0,5,6,0,0,0,DAMAGE,NONE,,,,,,0,0,0,4,false,ARMOR
DAGGER,dagger,A short bladed dagger. Quicker to wield than a sword but less punishing on a hit.,WEAPON,METAL,1,3,0,0,0,0,0,DAMAGE,NONE,,,,,,0,0,1,7,false,
AMULET_OF_LIGHT,amulet of light,A pale gem on a leather cord. Sheds a wide radius of soft light.,AMULET,MAGIC,0,0,0,0,10,0,0,NOTHING,NONE,,,,,,0,0,0,6,false,AMULET
FIRE_BOMB,fire bomb,"A flask of unstable alchemy. On impact, deals 1+level damage and ignites 2+level tiles around the target.",,MAGIC,0,0,0,0,0,0,0,IGNITE,NONE,,,,,,0,0,0,3,false,
BLAST_BOMB,blast bomb,"A heavy iron sphere that detonates concussively, hurting everything around the impact point.",,MAGIC,0,0,0,0,0,0,0,BLAST,NONE,,,,,,0,0,2,3,false,
FREEZE_BOMB,freeze bomb,A frosted vial that shatters into a freezing burst — chills nearby creatures and douses any flames.,,MAGIC,0,0,0,0,0,0,0,FREEZE,NONE,,,,,,0,0,3,3,false,
OIL_BOMB,oil bomb,A glass sphere of dark oil. Shatters and slicks the floor on impact.,,MAGIC,0,0,0,0,0,0,0,OIL_SPLASH,NONE,,,,,,0,0,1,3,false,
HEALING_POTION,healing potion,A vial of bluish elixir. Restores HP on a draught — more at higher potion levels.,,MAGIC,0,0,0,0,0,0,20,NOTHING,HEAL,drink,,,,,0,0,2,2,false,
POWER_ORB,power orb,A glowing magical sphere. Absorbing it grants you a perk point.,,MAGIC,0,0,0,0,0,0,0,NOTHING,GRANT_PERK,absorb,,,,,0,0,0,8,true,
WAND_WATER,wand of water,A pale blue wand. Pools water on the target tile.,,WOOD,0,0,0,0,0,0,0,NOTHING,WAND,zap,WATER,,,,0,0,4,0,false,
WAND_OIL,wand of oil,A dark wand slick to the touch. Slicks oil onto the target tile.,,WOOD,0,0,0,0,0,0,0,NOTHING,WAND,zap,OIL,,,,0,0,1,0,false,
WAND_GRASS,wand of vegetation,A green wand bound with vine. Sprouts grass and trees at the target.,,WOOD,0,0,0,0,0,0,0,NOTHING,WAND,zap,GRASS,,,,0,0,5,0,false,
WAND_FUNGUS,wand of fungus,A spongy red-brown wand. Coaxes mushrooms up from the target.,,WOOD,0,0,0,0,0,0,0,NOTHING,WAND,zap,FUNGUS,,,,0,0,5,0,false,
WAND_FIRE,wand of fire,A blackened wand crackling with embers. Ignites the target.,,METAL,0,0,0,0,0,0,0,NOTHING,WAND,zap,FIRE,,,,0,0,2,0,false,
WAND_DOG,wand of dog,"A wand carved from antler. On a zap, summons a loyal dog beside you.",,WOOD,0,0,0,0,0,0,0,NOTHING,WAND,summon,,DOG,,,0,0,3,0,false,
WAND_DETONATION,wand of detonation,A blackened iron wand inlaid with red runes. Detonates the target tile in a ball of fire.,,WOOD,0,0,0,0,0,0,0,NOTHING,WAND,zap,DETONATION,,,,0,0,2,0,false,
WAND_MAGIC_MISSILE,wand of magic missile,A short wand topped with a pale chip. Fires a magic missile.,,WOOD,3,6,0,0,0,0,0,NOTHING,MAGIC_MISSILE,zap,,,,,0,0,0,0,false,
WAND_BANISHMENT,wand of banishment,A wand bound in tarnished silver. A bright beam of light leaves a banished ghost as a wisp of memory.,,WOOD,0,0,0,0,0,0,0,NOTHING,WAND,zap,BANISHMENT,,,,0,0,6,0,false,
WAND_LIGHTNING,wand of lightning,A wand that crackles with energy.  Bad news to those who are conductive.,,METAL,4,10,0,0,0,0,0,BLAST,WAND,zap,LIGHTNING,,,,0,0,7,0,false,
PEAR,pear,A ripe green pear. Juicy enough to take the edge off a hungry belly.,,FLESH,0,0,0,0,0,10000,0,NOTHING,EAT,eat,,,,,0,0,0,1,false,
FISH,delicious fish,A small fresh fish. So tasty that a stray cat or dog hit by it will follow you for the rest of its life.,,FLESH,0,0,0,0,0,30000,0,NOTHING,EAT,eat,,,CAT|DOG,,0,0,1,1,false,
PEAR_SCRUMPTIOUS,scrumptious pear,"A specially ripe pear, dripping with juice. Five times more filling than the ordinary kind.",,FLESH,0,0,0,0,0,50000,0,NOTHING,EAT,eat,,,,,0,0,2,1,false,
PEAR_SILVERY,silvery pear,A pear with skin that shimmers like polished silver. Mysterious.,,FLESH,0,0,0,0,0,10000,0,NOTHING,EAT,eat,,,,HOPE,1,0,3,1,false,
PEAR_CONFERENCE,conference pear,"A long elegant pear, reportedly the kind eaten at high meetings.",,FLESH,0,0,0,0,0,10000,0,NOTHING,EAT,eat,,,,ESP,1,0,4,1,false,
POTION_SORCERY,potion of sorcery,A glittering blue brew. Empowers every wand the drinker carries.,,MAGIC,0,0,0,0,0,0,0,NOTHING,DRINK,drink,,,,SORCERY,1,0,0,2,false,
POTION_GHOSTLINESS,potion of ghostliness,A swirling pearl-grey liquid. The drinker temporarily becomes ethereal — flies and slips through walls.,,MAGIC,0,0,0,0,0,0,0,NOTHING,DRINK,drink,,,,GHOSTLY,1,0,1,2,false,
POTION_INVISIBILITY,potion of invisibility,A clear potion that hides the imbiber from sight for a short while.,,MAGIC,0,0,0,0,0,0,0,NOTHING,DRINK,drink,,,,INVISIBLE,2,0,3,2,false,
POTION_POISON,potion of poison,"A sickly green elixir. Vile to drink, devastating to throw.",,MAGIC,4,8,0,0,0,0,0,DAMAGE,DRINK,drink,,,,POISONED,3,4,4,2,false,
